{"focus_object_id":"BRH-003","evidence_count":3,"observation_count":5,"accepted_observation_count":5,"candidate_count":0,"freshness_summary":"Source package lineage is complete; individual observation freshness dates vary or are absent.","authority_summary":"BRH-003 is Candidate in EK-BANK-RHYP-001; observations used by existing Banking runtime are governed presentation inputs.","lineage_coverage":"partial","inaccessible_count":0,"unavailable_count":0,"page":{"limit":25,"cursor":null,"has_more":false},"safe_unavailable_notices":[]}
